Role,Input
assistant,"Amy sat in the waiting room, tapping her foot anxiously. This was her fifth chance to get it right, and she couldn't afford to mess it up again. She had failed so many times before, but she had to keep trying.The door finally opened and a stern-looking woman beckoned her inside. Amy followed her into a small room and sat down at the table. The woman began to ask her questions, and Amy did her best to answer them truthfully. She didn't want to give the wrong impression or say something that would make her lose this chance. As the interview went on, Amy's nerves began to get the best of her. She stumbled over her words and lost her train of thought. The woman looked unimpressed and made a note on her clipboard. After what felt like an eternity, the interview was over. Amy left the room feeling defeated. She had tried so hard, but it didn't seem to be enough. As she walked out of the building, she saw a man sitting on the sidewalk with a cardboard sign that read, 'Anything helps.' Amy dug into her pocket and pulled out a few dollars. As she handed them to the man, she noticed something strange. He had a tattoo on his wrist that looked familiar. It was the same one she had. Amy's heart skipped a beat. She turned to the man and asked, 'How did you get that tattoo?' The man looked up at her and smiled. 'I got it when I was trying to turn my life around. It's a symbol of hope.' Amy felt a glimmer of hope herself. Maybe this wasn't the end of the road. Maybe she still had a chance to get it right."
user,write with a male character
assistant,"Jack sat nervously in the waiting room, tapping his foot on the ground. He had been called in for a job interview, and he knew he had to make a good impression. This was his dream job, and he had been preparing for weeks. He took a deep breath and checked his watch. He still had a few minutes to gather his thoughts.

The door finally opened, and a serious-looking man motioned for Jack to enter. Jack followed him into a small room and sat down. The interviewer began to ask him questions, and Jack did his best to answer truthfully and confidently. He knew he had the experience and skills required for the job, but he couldn't shake off the feeling that he wasn't making a good impression.

As the interview dragged on, Jack's nerves got the better of him. He struggled to find the right words and stumbled over his sentences. The interviewer looked at him sternly, and Jack knew he wasn't doing well. He tried to recover but the damage was done.

As he left the building, Jack felt defeated. He had tried his best, but it wasn't enough. He wondered if he would ever find the job that he truly enjoyed. As he walked down the street, he saw a homeless man sitting on the sidewalk doing some sketches. Jack was an artist himself and he approached the man to have a closer look. The man showed him his work and explained how he had struggled to pursue his passion but never gave up. Jack was inspired by the man's determination and offered some money to support his art.

As he walked away, Jack realized that he still had a chance to make his dream a reality. The man's passion for art had rubbed off on him, and the hope that he had lost began to return. He knew he couldn't give up and had to keep trying. He had the talent and the ambition, and he would find the right job eventually."
"
Final Story : Jack sat nervously in the waiting room, tapping his foot on the ground. He had been called in for a job interview, and he knew he had to make a good impression. This was his dream job, and he had been preparing for weeks. He took a deep breath and checked his watch. He still had a few minutes to gather his thoughts.

The door finally opened, and a serious-looking man motioned for Jack to enter. Jack followed him into a small room and sat down. The interviewer began to ask him questions, and Jack did his best to answer truthfully and confidently. He knew he had the experience and skills required for the job, but he couldn't shake off the feeling that he wasn't making a good impression.

As the interview dragged on, Jack's nerves got the better of him. He struggled to find the right words and stumbled over his sentences. The interviewer looked at him sternly, and Jack knew he wasn't doing well. He tried to recover but the damage was done.

As he left the building, Jack felt defeated. He had tried his best, but it wasn't enough. He wondered if he would ever find the job that he truly enjoyed. As he walked down the street, he saw a homeless man sitting on the sidewalk doing some sketches. Jack was an artist himself and he approached the man to have a closer look. The man showed him his work and explained how he had struggled to pursue his passion but never gave up. Jack was inspired by the man's determination and offered some money to support his art.

As he walked away, Jack realized that he still had a chance to make his dream a reality. The man's passion for art had rubbed off on him, and the hope that he had lost began to return. He knew he couldn't give up and had to keep trying. He had the talent and the ambition, and he would find the right job eventually."
